{
  "name": "Solar",
  "bg": "#fdf6e3",
  "fg": "#586e75",
  "accent": "#b58900",
  "border": "#eee8d5",
  "ansi": {
    "black": "#073642", "red": "#dc322f", "green": "#859900", "yellow": "#b58900",
    "blue": "#268bd2", "magenta": "#d33682", "cyan": "#2aa198", "white": "#eee8d5",
    "brightBlack": "#002b36", "brightRed": "#cb4b16", "brightGreen": "#586e75", "brightYellow": "#657b83",
    "brightBlue": "#839496", "brightMagenta": "#6c71c4", "brightCyan": "#93a1a1", "brightWhite": "#fdf6e3"
  },
  "syntax": { "keyword": "#859900", "string": "#2aa198", "number": "#d33682", "comment": "#93a1a1", "function": "#268bd2", "type": "#b58900" }
}
