{
  "name": "Obsidian",
  "bg": "#131416",
  "fg": "#e0e2e4",
  "accent": "#6a9fb5",
  "border": "#1f2125",
  "ansi": {
    "black": "#131416", "red": "#ac4142", "green": "#90a959", "yellow": "#f4bf75",
    "blue": "#6a9fb5", "magenta": "#aa759f", "cyan": "#75b5aa", "white": "#d0d0d0",
    "brightBlack": "#505050", "brightRed": "#ac4142", "brightGreen": "#90a959", "brightYellow": "#f4bf75",
    "brightBlue": "#6a9fb5", "brightMagenta": "#aa759f", "brightCyan": "#75b5aa", "brightWhite": "#f5f5f5"
  },
  "syntax": { "keyword": "#aa759f", "string": "#90a959", "number": "#d28445", "comment": "#505050", "function": "#6a9fb5", "type": "#f4bf75" }
}
