{
  "name": "Nebula",
  "bg": "#1e1e3f",
  "fg": "#e9e9f4",
  "accent": "#a277ff",
  "border": "#2a2a5a",
  "ansi": {
    "black": "#1e1e3f", "red": "#ff6767", "green": "#61ffca", "yellow": "#ffca85",
    "blue": "#82e2ff", "magenta": "#a277ff", "cyan": "#61ffca", "white": "#e9e9f4",
    "brightBlack": "#6272a4", "brightRed": "#ff6767", "brightGreen": "#61ffca", "brightYellow": "#ffcf7f",
    "brightBlue": "#82e2ff", "brightMagenta": "#a277ff", "brightCyan": "#61ffca", "brightWhite": "#ffffff"
  },
  "syntax": { "keyword": "#a277ff", "string": "#61ffca", "number": "#ffca85", "comment": "#6272a4", "function": "#82e2ff", "type": "#f694ff" }
}
