{
  "name": "Dracula",
  "bg": "#282a36",
  "fg": "#f8f8f2",
  "accent": "#bd93f9",
  "border": "#44475a",
  "ansi": {
    "black": "#21222c", "red": "#ff5555", "green": "#50fa7b", "yellow": "#f1fa8c",
    "blue": "#bd93f9", "magenta": "#ff79c6", "cyan": "#8be9fd", "white": "#f8f8f2",
    "brightBlack": "#6272a4", "brightRed": "#ff6e6e", "brightGreen": "#69ff94", "brightYellow": "#ffffa5",
    "brightBlue": "#d6acff", "brightMagenta": "#ff92df", "brightCyan": "#a4ffff", "brightWhite": "#ffffff"
  },
  "syntax": { "keyword": "#ff79c6", "string": "#f1fa8c", "number": "#bd93f9", "comment": "#6272a4", "function": "#50fa7b", "type": "#8be9fd" }
}
