{
  "name": "Stealth",
  "bg": "#0c0c0c",
  "fg": "#9e9e9e",
  "accent": "#3b3b3b",
  "border": "#1a1a1a",
  "ansi": {
    "black": "#0c0c0c", "red": "#7a7a7a", "green": "#7a7a7a", "yellow": "#7a7a7a",
    "blue": "#7a7a7a", "magenta": "#7a7a7a", "cyan": "#7a7a7a", "white": "#9e9e9e",
    "brightBlack": "#3b3b3b", "brightRed": "#b0b0b0", "brightGreen": "#b0b0b0", "brightYellow": "#b0b0b0",
    "brightBlue": "#b0b0b0", "brightMagenta": "#b0b0b0", "brightCyan": "#b0b0b0", "brightWhite": "#dddddd"
  },
  "syntax": { "keyword": "#b0b0b0", "string": "#9e9e9e", "number": "#b0b0b0", "comment": "#3b3b3b", "function": "#dddddd", "type": "#9e9e9e" }
}
